{
  "$schema": "../fixture.schema.json",
  "id": "SES-007-home-equivalence",
  "kind": "positive",
  "baseline": "VAR-01",
  "layer": "V",
  "source": ["../13-projection-equivalence.md", "../fixtures/positive-home.json", "../../examples/home-example.ts"],
  "semantic": {
    "composition": "home",
    "identities": ["home", "home.hero", "home.trending", "hero", "media-rail", "media-grid", "ranked-collection"],
    "operations": ["enter-world", "open-media", "view-all"]
  },
  "vectors": [
    {"id":"valid-home-core","visualLanguage":"core","allowedMutations":["orientation","enclosure","spacing","alignment"]},
    {"id":"valid-home-neo-edo","visualLanguage":"neo-edo","allowedMutations":["orientation","media-placement","enclosure","background","edges","texture","pattern","ornament"]},
    {"id":"valid-home-western-comics","visualLanguage":"western-comics","allowedMutations":["orientation","card-topology","media-placement","enclosure","background","edges","texture","pattern","ornament"]},
    {"id":"valid-home-cybernetic-minimalism","visualLanguage":"cybernetic-minimalism","allowedMutations":["orientation","card-topology","media-placement","enclosure","background","edges","texture","pattern","ornament"]}
  ],
  "equivalenceChecks": ["EQUIV-001","EQUIV-002","EQUIV-003","EQUIV-004","EQUIV-005","EQUIV-006","EQUIV-007"],
  "expected": {"result":"pass"}
}
